{
  "$schema": "https://json-schema.org/draft/2020-12/schema",
  "$id": "https://nimbly-docs.github.io/nimbly-docs/manifest/v1/schema.json",
  "title": "Nimbly Docs Manifest v1",
  "type": "object",
  "required": ["version", "title", "sections"],
  "properties": {
    "$schema": { "type": "string" },
    "version": { "type": "string", "pattern": "^1(\\.|$)" },
    "title": { "$ref": "#/$defs/localizable" },
    "description": { "$ref": "#/$defs/localizable" },
    "language": { "type": "string" },
    "theme": { "type": "string" },
    "chooseThemes": {
      "oneOf": [
        { "type": "boolean" },
        { "type": "array", "items": { "type": "string" } }
      ]
    },
    "home": { "type": "string", "pattern": "^[a-z0-9][a-z0-9/_-]{0,127}$" },
    "appearance": { "enum": ["light", "dark", "auto"] },
    "backLink": { "$ref": "#/$defs/backLink" },
    "logo": { "type": "string" },
    "editBase": { "type": "string" },
    "footer": { "type": "string" },
    "links": { "type": "array", "items": { "$ref": "#/$defs/link" } },
    "apiReference": { "$ref": "#/$defs/apiReference" },
    "languages": { "type": "array", "items": { "$ref": "#/$defs/language" } },
    "versions": { "type": "array", "items": { "$ref": "#/$defs/docVersion" } },
    "features": { "$ref": "#/$defs/features" },
    "themes": { "type": "array", "items": { "$ref": "#/$defs/theme" } },
    "sections": { "type": "array", "minItems": 1, "items": { "$ref": "#/$defs/section" } }
  },
  "$defs": {
    "id": { "type": "string", "pattern": "^[a-z0-9][a-z0-9/_-]{0,127}$" },
    "localizable": {
      "oneOf": [
        { "type": "string", "minLength": 1 },
        { "type": "object", "minProperties": 1, "additionalProperties": { "type": "string" } }
      ]
    },
    "page": {
      "type": "object",
      "required": ["id", "title"],
      "properties": {
        "id": { "$ref": "#/$defs/id" },
        "title": { "$ref": "#/$defs/localizable" },
        "source": { "$ref": "#/$defs/localizable" },
        "sources": { "type": "object", "additionalProperties": { "type": "string" } },
        "description": { "$ref": "#/$defs/localizable" },
        "badge": { "type": "string" },
        "hidden": { "type": "boolean" }
      },
      "additionalProperties": true
    },
    "section": {
      "type": "object",
      "required": ["id", "title"],
      "properties": {
        "id": { "$ref": "#/$defs/id" },
        "title": { "$ref": "#/$defs/localizable" },
        "icon": { "type": "string" },
        "collapsed": { "type": "boolean" },
        "pages": { "type": "array", "items": { "$ref": "#/$defs/page" } },
        "sections": { "type": "array", "items": { "$ref": "#/$defs/section" } }
      },
      "additionalProperties": true
    },
    "link": {
      "type": "object",
      "required": ["type", "url"],
      "properties": {
        "type": { "type": "string" },
        "url": { "type": "string", "format": "uri" },
        "label": { "type": "string" }
      },
      "additionalProperties": false
    },
    "apiReference": {
      "type": "object",
      "required": ["url"],
      "properties": {
        "url": { "type": "string", "format": "uri" },
        "label": { "type": "string" }
      },
      "additionalProperties": false
    },
    "backLink": {
      "type": "object",
      "required": ["url"],
      "properties": {
        "url": { "type": "string" },
        "label": { "$ref": "#/$defs/localizable" }
      },
      "additionalProperties": false
    },
    "language": {
      "type": "object",
      "required": ["code", "label"],
      "properties": {
        "code": { "type": "string", "pattern": "^[a-z]{2,3}(-[a-z0-9]{2,8})?$" },
        "label": { "type": "string" }
      },
      "additionalProperties": false
    },
    "features": {
      "type": "object",
      "properties": {
        "search": { "type": "boolean" },
        "toc": { "type": "boolean" },
        "copyCode": { "type": "boolean" },
        "previousNext": { "type": "boolean" },
        "breadcrumbs": { "type": "boolean" },
        "editLink": { "type": "boolean" },
        "sidebar": {
          "type": "object",
          "properties": {
            "collapsible": { "type": "boolean" },
            "defaultExpanded": { "type": "array", "items": { "type": "string" } }
          }
        }
      },
      "additionalProperties": true
    },
    "docVersion": {
      "type": "object",
      "required": ["id"],
      "properties": {
        "id": { "type": "string", "pattern": "^[A-Za-z0-9][A-Za-z0-9._-]{0,31}$" },
        "label": { "type": "string" },
        "manifest": { "type": "string" },
        "status": { "enum": ["current", "legacy", "unreleased"] }
      },
      "additionalProperties": false
    },
    "theme": {
      "type": "object",
      "required": ["name"],
      "properties": {
        "name": { "type": "string" },
        "base": { "enum": ["nimbly", "nimbus", "midnight", "paper", "sabbia", "material", "stellar", "evergreen"] },
        "light": { "type": "object", "additionalProperties": { "type": "string" } },
        "dark": { "type": "object", "additionalProperties": { "type": "string" } }
      },
      "additionalProperties": false
    }
  }
}
